{
  "id": "fundamentals-of-llms",
  "title": "The Fundamentals of LLMs",
  "subtitle": "From everyday intuition to production systems",
  "description": "A production-minded field guide to large language models, expanding from next-token prediction and transformers to runtime, model compression, open-weight customization, evaluation, deployment, and safety.",
  "coverEmoji": "🧠",
  "durationMinutes": 187,
  "tags": [
    "AI literacy",
    "LLMs",
    "Prompting",
    "RAG",
    "AI engineering"
  ],
  "theme": {
    "accent": "#38bdf8",
    "surface": "#0b1324",
    "glow": "rgba(56, 189, 248, 0.34)",
    "text": "#eef8ff"
  },
  "cheatSheet": [
    {
      "concept": "Next-token prediction",
      "reminder": "An LLM is always extending a token sequence, even when the answer feels conversational or analytical.",
      "useWhen": "Use this when you need the cleanest mental model for what the model is actually doing under the surface."
    },
    {
      "concept": "Parameters are patterns, not pages",
      "reminder": "Model weights compress recurring statistical structure; they do not behave like a live searchable database.",
      "useWhen": "Use this when explaining why a model can sound informed without reliably recalling or citing a fact."
    },
    {
      "concept": "Context is working memory",
      "reminder": "Instructions, retrieved evidence, chat history, tool results, and generated output all compete for the same token budget.",
      "useWhen": "Use this when a system works on short prompts but drifts in long conversations or large workflows."
    },
    {
      "concept": "Attention is selective weighting",
      "reminder": "Attention lets the model emphasize some earlier tokens over others, which is why prompt order and salience matter.",
      "useWhen": "Use this when debugging ignored requirements, buried evidence, or weak prompt structure."
    },
    {
      "concept": "Embeddings support search",
      "reminder": "Embeddings are for semantic comparison and retrieval, while generation models turn selected evidence into readable output.",
      "useWhen": "Use this when deciding whether the problem is finding the right information or phrasing the final answer."
    },
    {
      "concept": "Training sets the habits",
      "reminder": "Pretraining, curation, and post-training define which patterns the model is good at continuing before your prompt ever arrives.",
      "useWhen": "Use this when judging whether a bad behavior is a prompt issue, a system issue, or a deeper model issue."
    },
    {
      "concept": "Prompts steer, they do not guarantee",
      "reminder": "System messages, examples, schemas, and tools can strongly shape behavior, but they do not erase missing knowledge or brittle reasoning.",
      "useWhen": "Use this when moving from a demo prompt to a production workflow."
    },
    {
      "concept": "Retrieval beats stale memory",
      "reminder": "If the answer depends on changing or private facts, fetch evidence first instead of hoping the base model remembers it.",
      "useWhen": "Use this when deciding between RAG, tool use, or fine-tuning."
    },
    {
      "concept": "Evaluate the whole system",
      "reminder": "Prompts, models, retrievers, tool schemas, and UI all contribute to the final answer, so evals must measure the integrated workflow.",
      "useWhen": "Use this when a team is optimizing isolated components without checking end-user outcomes."
    },
    {
      "concept": "High stakes need handoffs",
      "reminder": "Human review, abstention, and reversible actions are product features, not admissions of failure.",
      "useWhen": "Use this when the system can affect money, rights, safety, privacy, or access."
    },
    {
      "concept": "Q, K, and V play different jobs",
      "reminder": "Queries ask what the current token needs, keys advertise what earlier tokens contain, and values carry the content that gets mixed in.",
      "useWhen": "Use this when attention feels mystical and you need a practical picture of how token-to-token lookup works."
    },
    {
      "concept": "The FFN is per-token compute",
      "reminder": "After attention mixes information across tokens, the feed-forward network reshapes each token locally and stores much of the model's feature logic.",
      "useWhen": "Use this when explaining why transformers are not just attention and why MLP size matters."
    },
    {
      "concept": "KV cache buys speed with memory",
      "reminder": "During decoding, the runtime stores old keys and values so it can avoid recomputing the whole prompt every token.",
      "useWhen": "Use this when serving gets slow or memory-heavy as conversations or context windows grow."
    },
    {
      "concept": "Dense and MoE trade compute differently",
      "reminder": "Dense models activate all weights every token, while MoE routes each token through a small expert subset to increase total capacity without equal active compute.",
      "useWhen": "Use this when comparing model families, serving costs, or why a model can have huge total parameters but lower per-token compute."
    },
    {
      "concept": "Customize open weights in layers",
      "reminder": "Start with prompting, retrieval, tools, and adapters before reaching for full fine-tuning or checkpoint surgery.",
      "useWhen": "Use this when an open model is close to useful and you need the safest lever that changes behavior."
    }
  ],
  "appendix": [
    {
      "title": "Mind map routes",
      "items": [
        "Fast intuition route: What an LLM is -> Tokens, context, and attention -> Limits, risks, and failure modes.",
        "Builder route: What an LLM is -> Tokens, context, and attention -> Prompting, structured outputs, and control -> Retrieval, tools, and agents.",
        "Search and grounding route: Meaning as vectors -> Retrieval, tools, and agents -> Evaluation, cost, and operations.",
        "Production route: How models are trained and aligned -> Prompting, structured outputs, and control -> Evaluation, cost, and operations -> Limits, risks, and failure modes.",
        "Architecture deep dive: What an LLM is -> Tokens, context, and attention -> Inside the transformer and inference runtime -> Scaling, compression, and open-weight models.",
        "Builder route: What an LLM is -> Tokens, context, and attention -> Inside the transformer and inference runtime -> Prompting, structured outputs, and control -> Retrieval, tools, and agents.",
        "Model strategy route: How models are trained and aligned -> Scaling, compression, and open-weight models -> Evaluation, cost, and operations -> Limits, risks, and failure modes."
      ]
    },
    {
      "title": "Plain-language glossary",
      "items": [
        "Token: a chunk of text the model processes internally, often smaller than a whole word.",
        "Context window: the total token budget available for the current request and response.",
        "Transformer: the model architecture that uses attention to weigh relationships across a token sequence.",
        "Embedding: a vector representation that lets software compare semantic similarity.",
        "RAG: retrieval-augmented generation, where relevant documents are fetched before the model answers.",
        "Tool call: a structured request from the model to external software for an exact action or lookup.",
        "Alignment: the broader effort to make model behavior useful, safe, and appropriate in a specific context.",
        "Self-attention: the mechanism that lets each token weigh which earlier tokens matter most for its next internal update.",
        "Query, key, value: three learned projections used by attention to score relevance and mix information.",
        "FFN or MLP: the feed-forward layer that transforms each token representation after attention has shared context.",
        "KV cache: stored keys and values from prior tokens that speed up autoregressive decoding.",
        "Dense model: a model where every layer is active for every token.",
        "MoE: mixture of experts, where routing activates only a subset of expert sub-networks for each token.",
        "Quantization: storing weights with fewer bits to reduce memory and often improve local deployability.",
        "Open-weight model: a model whose parameters are available for others to download and run under a stated license.",
        "LoRA: a low-rank adapter technique that changes behavior by training small extra matrices instead of rewriting all weights."
      ]
    },
    {
      "title": "Sample code patterns",
      "items": [
        "Tokenization sketch: tokens = tokenizer.encode(\"Why did the build fail?\").",
        "Embedding search sketch: queryVec = embed(question); hits = vectorIndex.search(queryVec, 5).",
        "Structured output sketch: response = model({ schema: { severity, summary } }).",
        "Tool call sketch: if tool == \"get_order_status\", execute({ orderId }).",
        "Guarded agent sketch: while steps < 6 and budget_ok and not done: decide -> call_tool -> verify -> summarize.",
        "Rollback sketch: if eval_score drops below threshold, restore previous prompt and retriever versions.",
        "Attention sketch: scores = softmax((Q @ K_transpose) / sqrt(head_dim)); mixed = scores @ V.",
        "Serving sketch: prefill(prompt_tokens) -> decode(next_token, kv_cache) -> append -> stop_if(eos).",
        "Quantized deploy sketch: weights = load_4bit(model_path); answer = runtime.generate(prompt, max_new_tokens=256).",
        "Adapter tuning sketch: base = load_model(); lora = train_adapter(base, instruction_data); merged = merge_if_needed(base, lora)."
      ]
    },
    {
      "title": "Production heuristics",
      "items": [
        "Prefer retrieval over retraining when the issue is freshness or private context.",
        "Prefer structured outputs over prose when downstream software must parse the result.",